{
  "$schema": "https://json-schema.org/draft/2020-12/schema",
  "$id": "https://shumo.local/schemas/gate_3_validator_contract.schema.json",
  "title": "Gate 3 Validator 语义合同",
  "type": "object",
  "additionalProperties": false,
  "required": [
    "schema_version", "validator_path", "validator_sha256", "supported_check_ids",
    "report_schema_path", "report_schema_sha256", "required_observations"
  ],
  "properties": {
    "schema_version": {"const": "1.0.0"},
    "validator_path": {"type": "string", "pattern": "^validators/.+"},
    "validator_sha256": {"$ref": "#/$defs/sha256"},
    "supported_check_ids": {
      "type": "array",
      "minItems": 1,
      "uniqueItems": true,
      "items": {"type": "string", "minLength": 1}
    },
    "report_schema_path": {"type": "string", "pattern": "^validators/.+\\.json$"},
    "report_schema_sha256": {"$ref": "#/$defs/sha256"},
    "required_observations": {
      "type": "object",
      "additionalProperties": {
        "type": "array",
        "minItems": 1,
        "uniqueItems": true,
        "items": {"type": "string", "minLength": 1}
      }
    }
  },
  "$defs": {
    "sha256": {"type": "string", "pattern": "^[a-f0-9]{64}$"}
  }
}
